id,type,category,work,difficulty,question,createdAt
cmh5evagb012hqhd9ayevwonx,CLOSED_SINGLE,HISTORICAL_LITERARY,Makbet,5,Jak metafora 'życia jako kiepskiego aktora' komentuje naturę teatru?,2025-10-24 22:16:55.212
cmh5evag9012gqhd9dwrh9x2p,CLOSED_SINGLE,HISTORICAL_LITERARY,Makbet,3,Jak Makbet odnosi się do jakubińskiej teorii Boskiego Prawa Królów?,2025-10-24 22:16:55.209
cmh5evag7012fqhd92750wiz6,CLOSED_SINGLE,HISTORICAL_LITERARY,Makbet,4,"Z perspektywy psychoanalitycznej, czym są wiedźmy?",2025-10-24 22:16:55.207
cmh5evag5012eqhd9ol7jmtea,CLOSED_SINGLE,HISTORICAL_LITERARY,Makbet,5,Jak interpretować prośbę Lady Makbet o 'unsex me here'?,2025-10-24 22:16:55.205
cmh5evag2012dqhd9zzqgeeg0,CLOSED_MULTIPLE,HISTORICAL_LITERARY,Makbet,5,Dopasuj koncepcje filozoficzne do ich realizacji w dramacie,2025-10-24 22:16:55.203
cmh5evag0012cqhd9yu700w8z,CLOSED_MULTIPLE,HISTORICAL_LITERARY,Makbet,4,Które interpretacje motywu krwi są uzasadnione w tekście? (wybierz wszystkie),2025-10-24 22:16:55.2
cmh5evafy012bqhd9zcfaqn3k,CLOSED_SINGLE,HISTORICAL_LITERARY,Makbet,3,Dlaczego rola Lady Makbet była szczególnie wymagająca w teatrze elżbietańskim?,2025-10-24 22:16:55.198
cmh5evafw012aqhd9tv5qrdbd,CLOSED_SINGLE,HISTORICAL_LITERARY,Makbet,4,Które źródło NIE było inspiracją dla Shakespeare'a przy pisaniu Makbeta?,2025-10-24 22:16:55.196
cmh5evafu0129qhd911v1jn8a,CLOSED_SINGLE,HISTORICAL_LITERARY,Makbet,5,Jak nihilizm Makbeta ('życie to opowieść idioty') odnosi się do elżbietańskiego światopoglądu?,2025-10-24 22:16:55.194
cmh5evafs0128qhd9h1m1wjig,CLOSED_SINGLE,HISTORICAL_LITERARY,Makbet,4,Co symbolizuje scena mycia rąk przez Lady Makbet w kontekście całego dramatu?,2025-10-24 22:16:55.192
cmh5evafp0127qhd9whyfqbq6,CLOSED_SINGLE,HISTORICAL_LITERARY,Makbet,5,Które stwierdzenie najlepiej opisuje moralną wymowę tragedii?,2025-10-24 22:16:55.19
cmh5evafn0126qhd9e6i4mqvr,CLOSED_SINGLE,HISTORICAL_LITERARY,Makbet,3,Jaki efekt osiąga Shakespeare przez kontrast między językiem Makbeta na początku i końcu dramatu?,2025-10-24 22:16:55.188
cmh5evafl0125qhd99lx704bd,CLOSED_SINGLE,HISTORICAL_LITERARY,Makbet,4,Dlaczego Makbet jest najkrótszą tragedią Shakespeare'a?,2025-10-24 22:16:55.186
cmh5evafj0124qhd9w7eyz2p2,CLOSED_SINGLE,HISTORICAL_LITERARY,Makbet,5,Jak Shakespeare przedstawia problem teodycei (sprawiedliwości Bożej) w finale?,2025-10-24 22:16:55.184
cmh5evafh0123qhd9qpsr25nj,CLOSED_SINGLE,HISTORICAL_LITERARY,Makbet,3,Dlaczego temat królobójstwa był szczególnie aktualny w 1606 roku?,2025-10-24 22:16:55.182
cmh5evaff0122qhd9l34ev1l6,CLOSED_SINGLE,HISTORICAL_LITERARY,Makbet,4,Jak Lady Makbet podważa elżbietańskie normy płciowe?,2025-10-24 22:16:55.18
cmh5evafd0121qhd9rmk1ixdm,CLOSED_SINGLE,HISTORICAL_LITERARY,Makbet,5,Jak można interpretować halucynacje Makbeta z perspektywy psychologicznej?,2025-10-24 22:16:55.178
cmh5evafb0120qhd956hfqwwi,CLOSED_SINGLE,HISTORICAL_LITERARY,Makbet,4,Czym różni się podejście Makbeta i Banka do przepowiedni?,2025-10-24 22:16:55.176
cmh5evaf9011zqhd9lbzhgn7v,CLOSED_SINGLE,HISTORICAL_LITERARY,Makbet,3,Co symbolizuje niemożność wypowiedzenia 'Amen' przez Makbeta po morderstwie?,2025-10-24 22:16:55.174
cmh5evaf7011yqhd9u6gen232,CLOSED_SINGLE,HISTORICAL_LITERARY,Makbet,4,W którym momencie następuje perypetia (punkt zwrotny) w tragedii?,2025-10-24 22:16:55.172
cmh5evaf5011xqhd9y5p88hmw,CLOSED_SINGLE,HISTORICAL_LITERARY,Makbet,5,Jak interpretować dwuznaczność przepowiedni wiedźm w kontekście problemu wolnej woli?,2025-10-24 22:16:55.17
cmh5evaf3011wqhd909g4ll7u,CLOSED_SINGLE,HISTORICAL_LITERARY,Makbet,4,"Dlaczego Shakespeare sprawia, że tylko Makbet widzi ducha Banka?",2025-10-24 22:16:55.167
cmh5evaf1011vqhd9a6nxxe6v,CLOSED_SINGLE,HISTORICAL_LITERARY,Makbet,3,Które zdanie najlepiej opisuje funkcję motywu snu w tragedii?,2025-10-24 22:16:55.165
cmh5evaey011uqhd9hwzrvp9l,CLOSED_SINGLE,HISTORICAL_LITERARY,Przedwiośnie,2,Co oznaczają 'czerwone sztandary' wspominane przez Cezarego?,2025-10-24 22:16:55.163
cmh5evaew011tqhd9l3d2vx0y,SHORT_ANSWER,HISTORICAL_LITERARY,Przedwiośnie,2,Opisz relację Cezarego z Laurą Kościeniecką.,2025-10-24 22:16:55.16
cmh5evaeu011sqhd9x7d5nj35,CLOSED_SINGLE,HISTORICAL_LITERARY,Przedwiośnie,3,Jak Żeromski przedstawia polską inteligencję?,2025-10-24 22:16:55.158
cmh5evaes011rqhd9knwy2jri,CLOSED_MULTIPLE,HISTORICAL_LITERARY,Przedwiośnie,2,"Dopasuj miejsca do wydarzeń, które się tam rozgrywają.",2025-10-24 22:16:55.156
cmh5evaep011qqhd9hxd789ph,CLOSED_SINGLE,HISTORICAL_LITERARY,Przedwiośnie,2,Jakie znaczenie ma postać księdza Anastazego?,2025-10-24 22:16:55.154
cmh5evaen011pqhd90yvnq8ys,CLOSED_MULTIPLE,HISTORICAL_LITERARY,Przedwiośnie,3,Które problemy społeczne porusza Żeromski? (wybierz wszystkie),2025-10-24 22:16:55.151
cmh5evael011oqhd9z5j91qm7,CLOSED_SINGLE,HISTORICAL_LITERARY,Przedwiośnie,3,Kto jest narratorem powieści?,2025-10-24 22:16:55.149
cmh5evaej011nqhd966pd8a53,CLOSED_SINGLE,HISTORICAL_LITERARY,Przedwiośnie,2,W jakim roku została ukończona powieść 'Przedwiośnie'?,2025-10-24 22:16:55.147
cmh5evaeh011mqhd9f01xr7oo,CLOSED_SINGLE,HISTORICAL_LITERARY,Przedwiośnie,3,Jaka jest wymowa ideowa zakończenia powieści?,2025-10-24 22:16:55.145
cmh5evaee011lqhd956xeumfi,SHORT_ANSWER,HISTORICAL_LITERARY,Przedwiośnie,3,Scharakteryzuj ewolucję Cezarego Baryki od idealisty do rewolucjonisty.,2025-10-24 22:16:55.142
cmh5evaec011kqhd9k9u2wcnl,SHORT_ANSWER,HISTORICAL_LITERARY,Przedwiośnie,2,"Opisz, co symbolizują 'szklane domy' w powieści.",2025-10-24 22:16:55.14
cmh5evae9011jqhd9ionnu7pj,SHORT_ANSWER,HISTORICAL_LITERARY,Przedwiośnie,2,Wyjaśnij symbolikę tytułu 'Przedwiośnie' w kontekście powieści.,2025-10-24 22:16:55.138
cmh5evae7011iqhd9lti70x9a,CLOSED_MULTIPLE,HISTORICAL_LITERARY,Przedwiośnie,2,Które kobiety są związane z Cezarym? (wybierz wszystkie),2025-10-24 22:16:55.136
cmh5evae5011hqhd9ilbei24d,CLOSED_MULTIPLE,HISTORICAL_LITERARY,Przedwiośnie,3,"Dopasuj motywy do części powieści, w których dominują.",2025-10-24 22:16:55.134
cmh5evae3011gqhd9xwp9hm0o,CLOSED_MULTIPLE,HISTORICAL_LITERARY,Przedwiośnie,2,Uzupełnij informacje o fabule powieści.,2025-10-24 22:16:55.131
cmh5evae1011fqhd9t9lic9m3,CLOSED_MULTIPLE,HISTORICAL_LITERARY,Przedwiośnie,3,Które cechy charakteryzują Cezarego Barykę? (wybierz wszystkie poprawne),2025-10-24 22:16:55.129
cmh5evadz011eqhd9youcqqvz,CLOSED_MULTIPLE,HISTORICAL_LITERARY,Przedwiośnie,2,Które miejsca odwiedza Cezary podczas swojej wędrówki? (wybierz wszystkie poprawne),2025-10-24 22:16:55.127
cmh5evadw011dqhd9qnv1ox75,CLOSED_MULTIPLE,HISTORICAL_LITERARY,Przedwiośnie,2,Dopasuj postacie do ich ról w powieści.,2025-10-24 22:16:55.125
cmh5evadu011cqhd999ft3i8j,CLOSED_SINGLE,HISTORICAL_LITERARY,Przedwiośnie,2,Co Cezary robi batem w Leńcu?,2025-10-24 22:16:55.123
cmh5evads011bqhd9blc6o8eq,CLOSED_SINGLE,HISTORICAL_LITERARY,Przedwiośnie,3,Jaki jest stosunek narratora do różnych klas społecznych w powieści?,2025-10-24 22:16:55.12
cmh5evadq011aqhd9acnu9fqj,CLOSED_SINGLE,HISTORICAL_LITERARY,Przedwiośnie,2,Jaką dzielnicę Warszawy obserwuje Cezary mieszkając u Buławnika?,2025-10-24 22:16:55.118
cmh5evado0119qhd93967xew9,CLOSED_SINGLE,HISTORICAL_LITERARY,Przedwiośnie,3,Co symbolizuje przemiana Cezarego od żołnierza do rewolucjonisty?,2025-10-24 22:16:55.116
cmh5evadm0118qhd9cyqquhw7,CLOSED_SINGLE,HISTORICAL_LITERARY,Przedwiośnie,2,Dlaczego Laura nie może być z Cezarym po ślubie z Barwickim?,2025-10-24 22:16:55.114
cmh5evadk0117qhd95ubftegc,CLOSED_SINGLE,HISTORICAL_LITERARY,Przedwiośnie,3,Jaki konflikt wewnętrzny przeżywa Cezary w Warszawie?,2025-10-24 22:16:55.112
cmh5evadh0116qhd9d2rbsuif,CLOSED_SINGLE,HISTORICAL_LITERARY,Przedwiośnie,2,Co się stało z ojcem Cezarego?,2025-10-24 22:16:55.11
cmh5evadf0115qhd9awwoeegh,CLOSED_SINGLE,HISTORICAL_LITERARY,Przedwiośnie,3,Który z bohaterów reprezentuje typ polskiego karierowicza w carskiej Rosji?,2025-10-24 22:16:55.108
cmh5evadd0114qhd9aemz1wh1,CLOSED_SINGLE,HISTORICAL_LITERARY,Przedwiośnie,2,Jaki jest stosunek Jadwigi Barykowej do Rosji?,2025-10-24 22:16:55.106
cmh5evadb0113qhd9la9ybvof,CLOSED_SINGLE,HISTORICAL_LITERARY,Przedwiośnie,2,Co oznacza tytuł 'Przedwiośnie'?,2025-10-24 22:16:55.103
cmh5evad90112qhd9fay3hjrr,CLOSED_SINGLE,HISTORICAL_LITERARY,Przedwiośnie,2,Jak kończy się powieść?,2025-10-24 22:16:55.101
cmh5evad60111qhd9ffwiduk8,CLOSED_SINGLE,HISTORICAL_LITERARY,Przedwiośnie,1,Gdzie Laura spotyka się z Cezarym w Warszawie?,2025-10-24 22:16:55.099
cmh5evad40110qhd9nlsbb8sl,CLOSED_SINGLE,HISTORICAL_LITERARY,Przedwiośnie,2,Dlaczego Cezary wybiega z zebrania komunistycznego?,2025-10-24 22:16:55.096
cmh5evad1010zqhd9ql0k5j4b,CLOSED_SINGLE,HISTORICAL_LITERARY,Przedwiośnie,2,Gdzie odbywa się tajne zebranie komunistyczne?,2025-10-24 22:16:55.094
cmh5evacz010yqhd98b0giyfk,CLOSED_SINGLE,HISTORICAL_LITERARY,Przedwiośnie,2,Kim jest Antoni Lulek?,2025-10-24 22:16:55.091
cmh5evacx010xqhd9vj21vh50,CLOSED_SINGLE,HISTORICAL_LITERARY,Przedwiośnie,2,Kim jest Szymon Gajowiec?,2025-10-24 22:16:55.089
cmh5evacu010wqhd9enlriuww,CLOSED_SINGLE,HISTORICAL_LITERARY,Przedwiośnie,1,Gdzie Cezary mieszka po powrocie do Warszawy?,2025-10-24 22:16:55.087
cmh5evacs010vqhd9szkygbpa,CLOSED_SINGLE,HISTORICAL_LITERARY,Przedwiośnie,2,Jak umiera Karolina?,2025-10-24 22:16:55.084
cmh5evacq010uqhd99rc4vqd4,CLOSED_SINGLE,HISTORICAL_LITERARY,Przedwiośnie,1,Kim jest Karolina Szarłatowiczówna?,2025-10-24 22:16:55.082
cmh5evaco010tqhd9nlttc152,CLOSED_SINGLE,HISTORICAL_LITERARY,Przedwiośnie,2,Za kogo wychodzi Laura Kościeniecka?,2025-10-24 22:16:55.08
cmh5evacl010sqhd9xe7b03h9,CLOSED_SINGLE,HISTORICAL_LITERARY,Przedwiośnie,1,Jak ma na imię ukochana Cezarego z Nawłoci?,2025-10-24 22:16:55.078
cmh5evacj010rqhd9t4028avs,CLOSED_SINGLE,HISTORICAL_LITERARY,Przedwiośnie,1,Kim jest Hipolit Wielosławski?,2025-10-24 22:16:55.076
cmh5evach010qqhd9pu8m0dd0,CLOSED_SINGLE,HISTORICAL_LITERARY,Przedwiośnie,1,Jak nazywa się majątek Wielosławskich?,2025-10-24 22:16:55.074
cmh5evacf010pqhd9tedt8vex,CLOSED_SINGLE,HISTORICAL_LITERARY,Przedwiośnie,1,W jakiej wojnie uczestniczy Cezary po przybyciu do Polski?,2025-10-24 22:16:55.071
cmh5evacd010oqhd9rv7plyec,CLOSED_SINGLE,HISTORICAL_LITERARY,Przedwiośnie,1,Jak umiera matka Cezarego?,2025-10-24 22:16:55.069
cmh5evaca010nqhd9qy7xoa3y,CLOSED_SINGLE,HISTORICAL_LITERARY,Przedwiośnie,1,Co symbolizują 'szklane domy' w powieści?,2025-10-24 22:16:55.067
cmh5evac8010mqhd9soz5b1pf,CLOSED_SINGLE,HISTORICAL_LITERARY,Przedwiośnie,1,Kim z zawodu był Seweryn Baryka?,2025-10-24 22:16:55.065
cmh5evac6010lqhd9t0ia23bp,CLOSED_SINGLE,HISTORICAL_LITERARY,Przedwiośnie,1,W jakim mieście Cezary Baryka spędził dzieciństwo?,2025-10-24 22:16:55.063
cmh5evac4010kqhd9otr23zvb,CLOSED_SINGLE,HISTORICAL_LITERARY,Przedwiośnie,1,Jak ma na imię główny bohater powieści?,2025-10-24 22:16:55.061
cmh5evac2010jqhd95ar23ndi,CLOSED_SINGLE,HISTORICAL_LITERARY,Przedwiośnie,1,Kto jest autorem powieści 'Przedwiośnie'?,2025-10-24 22:16:55.058
cmh5evac0010iqhd9eo6ofn7d,SHORT_ANSWER,HISTORICAL_LITERARY,Lalka,4,Porównaj postawy Wokulskiego i Ochockiego wobec kobiet i małżeństwa.,2025-10-24 22:16:55.056
cmh5evabx010hqhd9r3mo1j7k,CLOSED_MULTIPLE,HISTORICAL_LITERARY,Lalka,4,Dopasuj wątki poboczne do ich funkcji w strukturze powieści.,2025-10-24 22:16:55.054
cmh5evabv010gqhd9xq990bmx,CLOSED_MULTIPLE,HISTORICAL_LITERARY,Lalka,3,Które zdania o finale powieści są prawdziwe? (wybierz wszystkie poprawne),2025-10-24 22:16:55.051
cmh5evabt010fqhd9qstait0n,CLOSED_SINGLE,HISTORICAL_LITERARY,Lalka,3,Za co Wokulski wypłacił premię dżokejowi po wyścigu?,2025-10-24 22:16:55.049
cmh5evabq010eqhd9xm1q90xy,CLOSED_SINGLE,HISTORICAL_LITERARY,Lalka,2,Ile pieniędzy Wokulski ofiarował pierwszej napotkanej prostytutce?,2025-10-24 22:16:55.047
cmh5evabo010dqhd9cs6eat1r,SHORT_ANSWER,HISTORICAL_LITERARY,Lalka,3,Scharakteryzuj postać Maruszewicza.,2025-10-24 22:16:55.045
cmh5evabm010cqhd9m6eiog6o,SHORT_ANSWER,HISTORICAL_LITERARY,Lalka,2,"Wyjaśnij, dlaczego baron Dalski wyzwał Starskiego na pojedynek.",2025-10-24 22:16:55.043
cmh5evabk010bqhd998ix1oml,SHORT_ANSWER,HISTORICAL_LITERARY,Lalka,3,"Opisz, jak Wokulski pomagał ludziom w potrzebie.",2025-10-24 22:16:55.04
cmh5evabi010aqhd9utp5wo94,SHORT_ANSWER,HISTORICAL_LITERARY,Lalka,2,"Wyjaśnij, kim była pani Wąsowska i jaką rolę odegrała w życiu Wokulskiego.",2025-10-24 22:16:55.038
cmh5evabf0109qhd93j19pf75,CLOSED_MULTIPLE,HISTORICAL_LITERARY,Lalka,4,"Dopasuj cytaty do postaci, które je wypowiedziały lub ich dotyczą.",2025-10-24 22:16:55.036
cmh5evabd0108qhd9sslwmyzl,CLOSED_MULTIPLE,HISTORICAL_LITERARY,Lalka,3,Uzupełnij informacje o Henryku Szlangbaumie.,2025-10-24 22:16:55.033
cmh5evaba0107qhd9bw27m8mp,CLOSED_SINGLE,HISTORICAL_LITERARY,Lalka,2,Kto odziedziczył 60 tysięcy rubli od ciotki Hortensji?,2025-10-24 22:16:55.031
cmh5evab80106qhd9zp7n3p67,CLOSED_SINGLE,HISTORICAL_LITERARY,Lalka,3,Ile wynosił zysk ze spółki handlującej z cesarstwem?,2025-10-24 22:16:55.028
cmh5evab60105qhd9vp3hexru,CLOSED_SINGLE,HISTORICAL_LITERARY,Lalka,2,Ile Wokulski zapłacił za klacz wyścigową od Maruszewicza?,2025-10-24 22:16:55.026
cmh5evab30104qhd9b1naymrm,CLOSED_SINGLE,HISTORICAL_LITERARY,Lalka,3,Co Wokulski zobaczył w konfesjonale w kościele?,2025-10-24 22:16:55.024
cmh5evab10103qhd9lltpaxt5,CLOSED_MULTIPLE,HISTORICAL_LITERARY,Lalka,3,Dopasuj osoby do ich zawodów lub zajęć w powieści.,2025-10-24 22:16:55.021
cmh5evaay0102qhd9clp7vb1m,CLOSED_MULTIPLE,HISTORICAL_LITERARY,Lalka,4,Które cechy charakteryzują prezesową Zasławską? (wybierz wszystkie poprawne),2025-10-24 22:16:55.019
cmh5evaaw0101qhd9mowplkkw,CLOSED_MULTIPLE,HISTORICAL_LITERARY,Lalka,2,Uzupełnij informacje o młodości Wokulskiego.,2025-10-24 22:16:55.016
cmh5evaat0100qhd9evui06gw,CLOSED_MULTIPLE,HISTORICAL_LITERARY,Lalka,3,Dopasuj postacie do ich marzeń i aspiracji.,2025-10-24 22:16:55.014
cmh5evaar00zzqhd97ral9s4n,CLOSED_SINGLE,HISTORICAL_LITERARY,Lalka,2,Gdzie mieszkał Ludwik Stawski - zaginiony mąż Heleny?,2025-10-24 22:16:55.011
cmh5evaao00zyqhd92nt4ioww,CLOSED_SINGLE,HISTORICAL_LITERARY,Lalka,3,"Kto powiedział, że Wokulski to polski romantyk i półgłówek?",2025-10-24 22:16:55.008
cmh5evaak00zxqhd9omk8nt7l,CLOSED_SINGLE,HISTORICAL_LITERARY,Lalka,2,Ile pieniędzy Wokulski zapisał Ochockiemu w testamencie?,2025-10-24 22:16:55.005
cmh5evaae00zwqhd9ssfxbupt,CLOSED_SINGLE,HISTORICAL_LITERARY,Lalka,3,Jaki metal Geist chciał stworzyć jako swoje największe odkrycie?,2025-10-24 22:16:54.998
cmh5evaab00zvqhd9corw1wa9,CLOSED_SINGLE,HISTORICAL_LITERARY,Lalka,2,"Kto w „Lalce” wygłosił przemówienie o małżeństwie jako związku rozumnym, a nie miłosnym?",2025-10-24 22:16:54.996
cmh5evaa900zuqhd9a1tv51xm,CLOSED_SINGLE,HISTORICAL_LITERARY,Lalka,3,Ile tysięcy rubli długów miał Kazimierz Starski?,2025-10-24 22:16:54.994
cmh5evaa700ztqhd9glidvig6,CLOSED_SINGLE,HISTORICAL_LITERARY,Lalka,2,Kto był ojcem chrzestnym dziecka Wysockiego?,2025-10-24 22:16:54.991
cmh5evaa500zsqhd9bojsnzcj,CLOSED_MULTIPLE,HISTORICAL_LITERARY,Lalka,2,Które działania Wokulskiego były motywowane miłością do Izabeli? (wybierz wszystkie poprawne),2025-10-24 22:16:54.989
cmh5evaa200zrqhd9fkq2ei9o,CLOSED_MULTIPLE,HISTORICAL_LITERARY,Lalka,3,Dopasuj miejsca w Paryżu do ich symbolicznego znaczenia dla Wokulskiego.,2025-10-24 22:16:54.987
cmh5evaa000zqqhd99u2quua4,CLOSED_SINGLE,HISTORICAL_LITERARY,Lalka,2,Jaki prezent Wokulski kupił Mariannie (byłej prostytutce) na ślub?,2025-10-24 22:16:54.984
cmh5eva9y00zpqhd9yiciiwpk,CLOSED_SINGLE,HISTORICAL_LITERARY,Lalka,3,Co Wokulski planował zbudować na Powiślu?,2025-10-24 22:16:54.982
cmh5eva9v00zoqhd9ro8p3cvp,CLOSED_SINGLE,HISTORICAL_LITERARY,Lalka,2,Kto kupił sklep Wokulskiego?,2025-10-24 22:16:54.98
cmh5eva9t00znqhd90a21uojo,SHORT_ANSWER,HISTORICAL_LITERARY,Lalka,3,Opisz proces sądowy o lalkę między Heleną Stawską a baronową Krzeszowską.,2025-10-24 22:16:54.978
cmh5eva9r00zmqhd9wx8sphkl,SHORT_ANSWER,HISTORICAL_LITERARY,Lalka,2,"Wyjaśnij, czym zajmował się doktor Szuman.",2025-10-24 22:16:54.975
cmh5eva9o00zlqhd931ie8feh,SHORT_ANSWER,HISTORICAL_LITERARY,Lalka,3,Scharakteryzuj relację między Wokulskim a Rzeckim.,2025-10-24 22:16:54.972
cmh5eva9l00zkqhd9smdlc290,SHORT_ANSWER,HISTORICAL_LITERARY,Lalka,2,"Wyjaśnij, dlaczego Wokulski zorganizował aplauz dla Rossiego.",2025-10-24 22:16:54.97
cmh5eva9j00zjqhd9x34neg6t,CLOSED_MULTIPLE,HISTORICAL_LITERARY,Lalka,4,Dopasuj symbole do ich znaczenia w powieści.,2025-10-24 22:16:54.967
cmh5eva9g00ziqhd94arv3zbs,CLOSED_MULTIPLE,HISTORICAL_LITERARY,Lalka,3,Uzupełnij informacje o finale powieści.,2025-10-24 22:16:54.964
cmh5eva9e00zhqhd94r5sgh3h,CLOSED_SINGLE,HISTORICAL_LITERARY,Lalka,2,Ile pieniędzy Wokulski ofiarował podczas kwesty w kościele?,2025-10-24 22:16:54.962
cmh5eva9b00zgqhd9fnesgys7,CLOSED_SINGLE,HISTORICAL_LITERARY,Lalka,3,Co było przyczyną wyjazdu Wokulskiego z pociągu w Skierniewicach?,2025-10-24 22:16:54.96
cmh5eva9900zfqhd9m0eibmf2,CLOSED_SINGLE,HISTORICAL_LITERARY,Lalka,2,Kto prowadził Pamiętnik starego subiekta?,2025-10-24 22:16:54.957
cmh5eva9500zeqhd9b44lz5im,CLOSED_MULTIPLE,HISTORICAL_LITERARY,Lalka,4,Dopasuj postaci do ich kluczowych decyzji życiowych.,2025-10-24 22:16:54.954
cmh5eva8z00zdqhd9ee2ucumh,CLOSED_MULTIPLE,HISTORICAL_LITERARY,Lalka,3,Które zdania o Wokulskim są prawdziwe? (wybierz wszystkie poprawne),2025-10-24 22:16:54.948
cmh5eva8x00zcqhd9mg63waqb,CLOSED_MULTIPLE,HISTORICAL_LITERARY,Lalka,2,Uzupełnij informacje o panu Tomaszu Łęckim.,2025-10-24 22:16:54.945
cmh5eva8u00zbqhd99iywhd80,CLOSED_MULTIPLE,HISTORICAL_LITERARY,Lalka,3,"Dopasuj wydarzenia do miejsc, w których się rozegrały.",2025-10-24 22:16:54.943
cmh5eva8s00zaqhd9aayw55db,CLOSED_SINGLE,HISTORICAL_LITERARY,Lalka,4,Dlaczego Wokulski zrezygnował z pracy u profesora Geista w Paryżu?,2025-10-24 22:16:54.94
cmh5eva8q00z9qhd9oncpc65t,CLOSED_SINGLE,HISTORICAL_LITERARY,Lalka,3,Jaką cenę zapłacił Wokulski za kamienicę Łęckich?,2025-10-24 22:16:54.938
cmh5eva8o00z8qhd9tiucv9t2,CLOSED_SINGLE,HISTORICAL_LITERARY,Lalka,2,Kto uratował życie Wokulskiego podczas próby samobójstwa w Skierniewicach?,2025-10-24 22:16:54.936
cmh5eva8m00z7qhd9h8kejt4w,CLOSED_SINGLE,HISTORICAL_LITERARY,Lalka,3,Co symbolizuje porównanie Warszawy do gąsienicy przez Wokulskiego w Paryżu?,2025-10-24 22:16:54.934
cmh5eva8k00z6qhd9kjbq2rbx,CLOSED_SINGLE,HISTORICAL_LITERARY,Lalka,2,Gdzie Wokulski spotkał Izabelę po raz pierwszy?,2025-10-24 22:16:54.932
cmh5eva8i00z5qhd9tvvox2rf,CLOSED_SINGLE,HISTORICAL_LITERARY,Lalka,3,Dlaczego Wokulski nie mógł zostać naukowcem po powrocie z Syberii?,2025-10-24 22:16:54.93
cmh5eva8g00z4qhd9je0x1c0z,CLOSED_SINGLE,HISTORICAL_LITERARY,Lalka,2,Ile lat Rzecki mieszkał w swoim ciemnym pokoju przy sklepie?,2025-10-24 22:16:54.928
cmh5eva8e00z3qhd979syfbut,CLOSED_SINGLE,HISTORICAL_LITERARY,Lalka,2,Kto był wspólnikiem Wokulskiego podczas zarabiania majątku na wojnie?,2025-10-24 22:16:54.926
cmh5eva8b00z2qhd9y3d7az0h,SHORT_ANSWER,HISTORICAL_LITERARY,,5,"Wyjaśnij, dlaczego Wokulski rezygnuje z kariery naukowej u Geista w Paryżu.",2025-10-24 22:16:54.924
cmh5eva8900z1qhd94cnndeuf,SHORT_ANSWER,HISTORICAL_LITERARY,Lalka,3,"Wyjaśnij, czym jest język ezopowy i jak Prus go stosuje w „Lalce.",2025-10-24 22:16:54.921
cmh5eva8700z0qhd92bvqfcos,CLOSED_MULTIPLE,HISTORICAL_LITERARY,Lalka,1,Które wydarzenia miały miejsce w życiu Wokulskiego? (wybierz wszystkie poprawne),2025-10-24 22:16:54.919
cmh5eva8500yzqhd9qi40y8bl,CLOSED_MULTIPLE,HISTORICAL_LITERARY,Lalka,2,Uzupełnij informacje o sklepie Wokulskiego.,2025-10-24 22:16:54.917
cmh5eva8200yyqhd9cqygd8ji,CLOSED_SINGLE,HISTORICAL_LITERARY,Lalka,2,Kto to była Florentyna w powieści?,2025-10-24 22:16:54.915
cmh5eva8000yxqhd90x3j5tea,CLOSED_SINGLE,HISTORICAL_LITERARY,Lalka,1,Ile lat miał Wokulski na początku akcji powieści?,2025-10-24 22:16:54.912
cmh5eva7y00ywqhd9jozxrdzo,CLOSED_SINGLE,HISTORICAL_LITERARY,Lalka,2,Gdzie Rzecki walczył po śmierci ojca?,2025-10-24 22:16:54.91
cmh5eva7v00yvqhd9ab449ofh,CLOSED_SINGLE,HISTORICAL_LITERARY,Lalka,2,Kto był pierwszym pracodawcą młodego Wokulskiego?,2025-10-24 22:16:54.908
cmh5eva7s00yuqhd9j0cbhm9j,CLOSED_SINGLE,HISTORICAL_LITERARY,Lalka,1,Ile pieniędzy Wokulski przywiózł z wojny w Bułgarii?,2025-10-24 22:16:54.905
cmh5eva7o00ytqhd97ldeu568,SHORT_ANSWER,HISTORICAL_LITERARY,Lalka,2,Kim był Maruszewicz w powieści?,2025-10-24 22:16:54.884
cmh5eva7500ysqhd9urxkp03x,SHORT_ANSWER,HISTORICAL_LITERARY,,1,Z jakiej rodziny pochodził Stanisław Wokulski?,2025-10-24 22:16:54.882
cmh5eva7300yrqhd91x6xs9jb,SHORT_ANSWER,HISTORICAL_LITERARY,Lalka,2,Kim był profesor Geist i gdzie go spotkał Wokulski?,2025-10-24 22:16:54.879
cmh5eva7000yqqhd9h08gt1zf,SHORT_ANSWER,HISTORICAL_LITERARY,Lalka,2,Opisz dzielnicę Powiśle w „Lalce”.,2025-10-24 22:16:54.877
cmh5eva6y00ypqhd9rwp4ys55,SHORT_ANSWER,HISTORICAL_LITERARY,,2,"Wyjaśnij, dlaczego Wokulski kupił kamienicę Łęckich za wygórowaną cenę.",2025-10-24 22:16:54.874
cmh5eva6w00yoqhd93kf3yjh6,SHORT_ANSWER,HISTORICAL_LITERARY,Lalka,2,Kim była Helena Stawska i czym różniła się od Izabeli Łęckiej?,2025-10-24 22:16:54.872
cmh5eva6t00ynqhd9dzt8amxl,SHORT_ANSWER,HISTORICAL_LITERARY,,2,Dlaczego Wokulski poślubił Małgorzatę Minclową?,2025-10-24 22:16:54.87
cmh5eva6r00ymqhd9lye9e373,SHORT_ANSWER,HISTORICAL_LITERARY,Lalka,2,Kim był Ignacy Rzecki i jaka była jego rola w życiu Wokulskiego?,2025-10-24 22:16:54.867
cmh5eva6p00ylqhd9px0s9hzt,CLOSED_MULTIPLE,HISTORICAL_LITERARY,Lalka,1,Dopasuj postaci do ich zawodów lub zajęć.,2025-10-24 22:16:54.865
cmh5eva6m00ykqhd99zog4pyg,CLOSED_MULTIPLE,HISTORICAL_LITERARY,Lalka,2,Które zdania dotyczące Izabeli Łęckiej są prawdziwe? (wybierz wszystkie poprawne),2025-10-24 22:16:54.862
cmh5eva6j00yjqhd9nj9ui3jt,CLOSED_MULTIPLE,HISTORICAL_LITERARY,Lalka,2,"Dopasuj miejsca do wydarzeń, które się w nich rozegrały.",2025-10-24 22:16:54.86
cmh5eva6h00yiqhd90qq3f7fe,CLOSED_MULTIPLE,HISTORICAL_LITERARY,Lalka,2,Uzupełnij informacje o życiu Wokulskiego.,2025-10-24 22:16:54.857
cmh5eva6e00yhqhd9jh8qwso7,CLOSED_MULTIPLE,HISTORICAL_LITERARY,Lalka,2,Które cechy charakteryzują Ignacego Rzeckiego? (wybierz wszystkie poprawne),2025-10-24 22:16:54.855
cmh5eva6b00ygqhd9fl0mosli,CLOSED_MULTIPLE,HISTORICAL_LITERARY,Lalka,2,Dopasuj postaci z „Lalki” do ich głównych cech charakteru.,2025-10-24 22:16:54.851
cmh5eva6800yfqhd973i6lrmb,CLOSED_SINGLE,HISTORICAL_LITERARY,Lalka,1,Gdzie Wokulski poznał Izabelę Łęcką?,2025-10-24 22:16:54.849
cmh5eva6600yeqhd9o6r98og7,CLOSED_SINGLE,HISTORICAL_LITERARY,Lalka,2,Kto kupił sklep Wokulskiego?,2025-10-24 22:16:54.847
cmh5eva6400ydqhd9wm9kbvig,CLOSED_SINGLE,HISTORICAL_LITERARY,Lalka,2,Kto był żydowskim przyjacielem i lekarzem Wokulskiego?,2025-10-24 22:16:54.844
cmh5eva6200ycqhd9gft1rfjo,CLOSED_SINGLE,HISTORICAL_LITERARY,Lalka,1,Jaki interes prowadził Wokulski?,2025-10-24 22:16:54.842
cmh5eva6000ybqhd9k4zapgb8,CLOSED_SINGLE,HISTORICAL_LITERARY,Lalka,2,Co łączyło Rzeckiego z Wokulskim?,2025-10-24 22:16:54.84
cmh5eva5y00yaqhd92e8johma,CLOSED_SINGLE,HISTORICAL_LITERARY,Lalka,2,Gdzie Wokulski spotkał profesora Geista?,2025-10-24 22:16:54.838
cmh5eva5v00y9qhd920vikuju,CLOSED_SINGLE,HISTORICAL_LITERARY,Lalka,1,W jakich latach toczy się akcja główna „Lalki”?,2025-10-24 22:16:54.836
cmh5eva5t00y8qhd9hsh6hewy,CLOSED_SINGLE,HISTORICAL_LITERARY,Lalka,2,Kim był Maruszewicz w powieści?,2025-10-24 22:16:54.834
cmh5eva5r00y7qhd9uyvvycwz,CLOSED_SINGLE,HISTORICAL_LITERARY,Lalka,2,Kim była Helena Stawska w powieści?,2025-10-24 22:16:54.831
cmh5eva5p00y6qhd9vcq444qj,CLOSED_SINGLE,HISTORICAL_LITERARY,Lalka,1,Z jakiej rodziny pochodził Stanisław Wokulski?,2025-10-24 22:16:54.829
cmh5eva5m00y5qhd9lbswcyef,CLOSED_SINGLE,HISTORICAL_LITERARY,Lalka,2,Co Wokulski kupił dla rodziny Łęckich za wygórowaną cenę?,2025-10-24 22:16:54.827
cmh5eva5k00y4qhd96jl5l5oa,CLOSED_SINGLE,HISTORICAL_LITERARY,Lalka,2,Kim był Suzin w życiu Wokulskiego?,2025-10-24 22:16:54.824
cmh5eva5i00y3qhd9y4twuhxv,CLOSED_SINGLE,HISTORICAL_LITERARY,Lalka,1,Kto prowadził pamiętnik w powieści?,2025-10-24 22:16:54.822
cmh5eva5g00y2qhd907zz8hnr,CLOSED_SINGLE,HISTORICAL_LITERARY,Lalka,2,Jak nazywa się warszawska dzielnica biedy opisana w powieści?,2025-10-24 22:16:54.82
cmh5eva5e00y1qhd9uszmy793,CLOSED_SINGLE,HISTORICAL_LITERARY,Lalka,2,Kto uratował życie Wokulskiego podczas próby samobójstwa?,2025-10-24 22:16:54.818
cmh5eva5c00y0qhd9fxnftjok,CLOSED_SINGLE,HISTORICAL_LITERARY,Lalka,1,Gdzie Wokulski uczęszczał na wykłady jako wolny słuchacz?,2025-10-24 22:16:54.816
cmh5eva5900xzqhd9zweo238p,CLOSED_SINGLE,HISTORICAL_LITERARY,Lalka,1,Jak nazywa się ojciec Izabeli Łęckiej?,2025-10-24 22:16:54.814
cmh5eva5700xyqhd9rl3wn0mq,CLOSED_SINGLE,HISTORICAL_LITERARY,Lalka,1,Z kim Wokulski wziął ślub dla pieniędzy?,2025-10-24 22:16:54.812
cmh5eva5500xxqhd90hqcf6a6,CLOSED_SINGLE,HISTORICAL_LITERARY,Lalka,1,Jak długo Ignacy Rzecki mieszkał w pokoju przy sklepie?,2025-10-24 22:16:54.81
cmh5eva5300xwqhd9i2nwytul,CLOSED_SINGLE,HISTORICAL_LITERARY,Lalka,1,Jak nazywa się najbliższy przyjaciel Stanisława Wokulskiego?,2025-10-24 22:16:54.807
cmh5eva5100xvqhd9xybdn25i,CLOSED_MULTIPLE,HISTORICAL_LITERARY,Lalka,4,"Dopasuj cytaty do postaci, które je wypowiadają lub których dotyczą.",2025-10-24 22:16:54.805
cmh5eva4y00xuqhd99ybzhs7i,CLOSED_SINGLE,HISTORICAL_LITERARY,Lalka,4,Dlaczego Wokulski nie mógł zostać uczonym po powrocie z Syberii?,2025-10-24 22:16:54.803
cmh5eva4w00xtqhd92hwaj6gy,CLOSED_SINGLE,HISTORICAL_LITERARY,Lalka,5,"Jaką rolę pełni scena, w której Rzecki nakręca mechaniczne zabawki w sklepie?",2025-10-24 22:16:54.8
