id,type,category,work,difficulty,question,createdAt
cmh5ev9hm00o3qhd9mabkkl3i,CLOSED_SINGLE,HISTORICAL_LITERARY,,2,Co według tomizmu było wrodzonymi darami boskimi?,2025-10-24 22:16:53.962
cmh5ev9hj00o2qhd97qbhs2pt,CLOSED_SINGLE,HISTORICAL_LITERARY,,2,Jaki był stosunek tomizmu do ciała i duszy?,2025-10-24 22:16:53.96
cmh5ev9hh00o1qhd9ov2zqcjx,CLOSED_SINGLE,HISTORICAL_LITERARY,,2,Jaki był stosunek augustynizmu do ciała i duszy?,2025-10-24 22:16:53.958
cmh5ev9hf00o0qhd9ebzadyzt,CLOSED_SINGLE,HISTORICAL_LITERARY,,1,Co to są roczniki?,2025-10-24 22:16:53.955
cmh5ev9hd00nzqhd9dd68vf7a,CLOSED_SINGLE,HISTORICAL_LITERARY,,2,Co symbolizowało światło w katedrach gotyckich?,2025-10-24 22:16:53.953
cmh5ev9hb00nyqhd9513p0j66,CLOSED_SINGLE,HISTORICAL_LITERARY,,1,Jaka była hierarchia społeczna w średniowieczu?,2025-10-24 22:16:53.951
cmh5ev9h800nxqhd9afg5rygd,CLOSED_SINGLE,HISTORICAL_LITERARY,,2,Z czego wykształciła się farsa?,2025-10-24 22:16:53.949
cmh5ev9h600nwqhd9s9m0t4y2,CLOSED_SINGLE,HISTORICAL_LITERARY,,1,Co to jest farsa?,2025-10-24 22:16:53.947
cmh5ev9h400nvqhd9459da0w0,CLOSED_SINGLE,HISTORICAL_LITERARY,,2,Co symbolizowały katedry gotyckie swoją strzelistością?,2025-10-24 22:16:53.944
cmh5ev9h200nuqhd9sjcmop7o,CLOSED_SINGLE,HISTORICAL_LITERARY,,2,Jaką funkcję pełniły budowle romańskie oprócz religijnej?,2025-10-24 22:16:53.942
cmh5ev9h000ntqhd9zuowlalw,CLOSED_SINGLE,HISTORICAL_LITERARY,,1,Co to jest romans rycerski?,2025-10-24 22:16:53.94
cmh5ev9gy00nsqhd9btorje3r,CLOSED_SINGLE,HISTORICAL_LITERARY,,1,Co to jest legenda w średniowieczu?,2025-10-24 22:16:53.938
cmh5ev9gw00nrqhd94z94lqzg,CLOSED_SINGLE,HISTORICAL_LITERARY,,2,Jaki był charakter kronik średniowiecznych?,2025-10-24 22:16:53.936
cmh5ev9gu00nqqhd9eexjqeod,CLOSED_SINGLE,HISTORICAL_LITERARY,,2,Co to jest psychomachia?,2025-10-24 22:16:53.934
cmh5ev9gs00npqhd9cvvcfum0,CLOSED_SINGLE,HISTORICAL_LITERARY,,1,Kiedy w Polsce rozpoczyna się epoka średniowiecza?,2025-10-24 22:16:53.932
cmh5ev9gq00noqhd94zllmvw0,CLOSED_SINGLE,HISTORICAL_LITERARY,,2,Jaki typ wiersza dominował w średniowieczu?,2025-10-24 22:16:53.93
cmh5ev9go00nnqhd93ff73f8r,CLOSED_SINGLE,HISTORICAL_LITERARY,,1,Co oznacza łacińskie wyrażenie 'ars moriendi'?,2025-10-24 22:16:53.928
cmh5ev9gm00nmqhd9706o9uzv,CLOSED_SINGLE,HISTORICAL_LITERARY,,1,Co to jest apokryf?,2025-10-24 22:16:53.926
cmh5ev9gk00nlqhd9cbj71yvg,CLOSED_SINGLE,HISTORICAL_LITERARY,,2,Jak tomizm pojmował człowieka?,2025-10-24 22:16:53.924
cmh5ev9gh00nkqhd9fx0gg422,CLOSED_SINGLE,HISTORICAL_LITERARY,,2,Co według augustynizmu było najważniejsze w człowieku?,2025-10-24 22:16:53.922
cmh5ev9gf00njqhd9rkboyxl9,CLOSED_SINGLE,HISTORICAL_LITERARY,,2,Co głosił franciszkanizm?,2025-10-24 22:16:53.92
cmh5ev9gd00niqhd9mnuaytwp,CLOSED_SINGLE,HISTORICAL_LITERARY,,1,Jak nazywali się wędrowni poeci-śpiewacy średniowiecza?,2025-10-24 22:16:53.918
cmh5ev9gc00nhqhd9gukjfmqk,CLOSED_SINGLE,HISTORICAL_LITERARY,,1,Jaki typ łuku charakteryzuje budowle gotyckie?,2025-10-24 22:16:53.916
cmh5ev9g900ngqhd9mw5oomji,CLOSED_SINGLE,HISTORICAL_LITERARY,,1,Jaki był podstawowy element konstrukcyjny budowli romańskich?,2025-10-24 22:16:53.914
cmh5ev9g700nfqhd964b7s13b,CLOSED_SINGLE,HISTORICAL_LITERARY,,2,Do jakiej filozofii nawiązywał tomizm?,2025-10-24 22:16:53.912
cmh5ev9g600neqhd983v3cbwm,CLOSED_SINGLE,HISTORICAL_LITERARY,,2,Do jakiej filozofii nawiązywał augustynizm?,2025-10-24 22:16:53.91
cmh5ev9g400ndqhd9svijm9gd,CLOSED_SINGLE,HISTORICAL_LITERARY,,1,Co to są archaizmy?,2025-10-24 22:16:53.908
cmh5ev9g200ncqhd9yet8icv3,CLOSED_SINGLE,HISTORICAL_LITERARY,,2,Dlaczego większość dzieł średniowiecznych była anonimowa?,2025-10-24 22:16:53.906
cmh5ev9g000nbqhd98z0ykdi2,CLOSED_SINGLE,HISTORICAL_LITERARY,,1,Co to jest pareneza?,2025-10-24 22:16:53.904
cmh5ev9fy00naqhd9mwbgccfj,CLOSED_SINGLE,HISTORICAL_LITERARY,,2,Jaki charakter miała literatura średniowieczna?,2025-10-24 22:16:53.902
cmh5ev9fv00n9qhd9k9jdv5je,CLOSED_SINGLE,HISTORICAL_LITERARY,,1,Który gatunek literacki zawierał opisy dziejów historycznych?,2025-10-24 22:16:53.9
cmh5ev9fu00n8qhd9fabfwktj,CLOSED_SINGLE,HISTORICAL_LITERARY,,2,Co to jest deesis?,2025-10-24 22:16:53.898
cmh5ev9fr00n7qhd9sh6ttzyz,CLOSED_SINGLE,HISTORICAL_LITERARY,,2,Co to jest pieta?,2025-10-24 22:16:53.896
cmh5ev9fp00n6qhd9w1klg88n,CLOSED_SINGLE,HISTORICAL_LITERARY,,2,Co oznacza motyw 'stabat mater dolorosa'?,2025-10-24 22:16:53.894
cmh5ev9fn00n5qhd9yii9z2xj,CLOSED_SINGLE,HISTORICAL_LITERARY,,1,Co to jest feudalizm?,2025-10-24 22:16:53.892
cmh5ev9fl00n4qhd9aea5urwh,CLOSED_SINGLE,HISTORICAL_LITERARY,,1,Co oznacza termin 'uniwersalizm średniowieczny'?,2025-10-24 22:16:53.89
cmh5ev9fj00n3qhd9gyghog40,CLOSED_SINGLE,HISTORICAL_LITERARY,,2,Kto propagował franciszkanizm?,2025-10-24 22:16:53.887
cmh5ev9fh00n2qhd9wsn2vq7p,CLOSED_SINGLE,HISTORICAL_LITERARY,,1,Co to jest scholastyka?,2025-10-24 22:16:53.885
cmh5ev9fe00n1qhd9khaeb9q5,CLOSED_SINGLE,HISTORICAL_LITERARY,,1,Co było główną cechą wzorca rycerza chrześcijańskiego?,2025-10-24 22:16:53.883
cmh5ev9fc00n0qhd90vimsb5g,CLOSED_SINGLE,HISTORICAL_LITERARY,,1,Który wzorzec osobowy reprezentował całkowite wyrzeczenie się dóbr doczesnych?,2025-10-24 22:16:53.881
cmh5ev9fa00mzqhd93qo0vo06,CLOSED_SINGLE,HISTORICAL_LITERARY,,1,Co charakteryzowało budowle romańskie?,2025-10-24 22:16:53.879
cmh5ev9f800myqhd9990ho5m4,CLOSED_SINGLE,HISTORICAL_LITERARY,,1,Który styl architektoniczny charakteryzuje się strzelistością i witrażami?,2025-10-24 22:16:53.877
cmh5ev9f600mxqhd9685t8uul,CLOSED_SINGLE,HISTORICAL_LITERARY,,1,Jaki styl architektoniczny dominował we wczesnym średniowieczu?,2025-10-24 22:16:53.874
cmh5ev9f400mwqhd93l6o6ct8,CLOSED_SINGLE,HISTORICAL_LITERARY,,1,Co to jest plankt?,2025-10-24 22:16:53.872
cmh5ev9f200mvqhd9loouj6cg,CLOSED_SINGLE,HISTORICAL_LITERARY,,1,Co oznacza francuskie wyrażenie 'chanson de geste'?,2025-10-24 22:16:53.87
cmh5ev9f000muqhd9m44d5qge,CLOSED_SINGLE,HISTORICAL_LITERARY,,1,Co to jest moralitet?,2025-10-24 22:16:53.868
cmh5ev9ey00mtqhd9sc5gzlsw,CLOSED_SINGLE,HISTORICAL_LITERARY,,1,Jak nazywał się średniowieczny dramat religijny ukazujący cuda świętych?,2025-10-24 22:16:53.866
cmh5ev9ev00msqhd94besxc5j,CLOSED_SINGLE,HISTORICAL_LITERARY,,1,Co to jest misterium?,2025-10-24 22:16:53.864
cmh5ev9et00mrqhd919dwzqiy,CLOSED_SINGLE,HISTORICAL_LITERARY,,1,Co oznacza termin 'hagiografia'?,2025-10-24 22:16:53.862
cmh5ev9er00mqqhd9xzlioel6,CLOSED_SINGLE,HISTORICAL_LITERARY,,1,Jaki był dominujący język warstw wykształconych w średniowieczu?,2025-10-24 22:16:53.86
cmh5ev9ep00mpqhd95s4w30go,CLOSED_SINGLE,HISTORICAL_LITERARY,,1,Co oznacza francuskie określenie 'danse macabre'?,2025-10-24 22:16:53.858
cmh5ev9eo00moqhd9pytrwdh6,CLOSED_SINGLE,HISTORICAL_LITERARY,,1,Co oznacza łacińskie wyrażenie 'memento mori'?,2025-10-24 22:16:53.856
cmh5ev9el00mnqhd9944d6w6c,CLOSED_SINGLE,HISTORICAL_LITERARY,,1,Kto jest twórcą tomizmu?,2025-10-24 22:16:53.854
cmh5ev9ek00mmqhd9cslc97yi,CLOSED_SINGLE,HISTORICAL_LITERARY,,1,Kto jest twórcą augustynizmu?,2025-10-24 22:16:53.852
cmh5ev9ei00mlqhd9bpqp95d3,CLOSED_SINGLE,HISTORICAL_LITERARY,,1,Na ile okresów dzieli się epoka średniowiecza?,2025-10-24 22:16:53.85
cmh5ev9eg00mkqhd97czs4ujp,CLOSED_SINGLE,HISTORICAL_LITERARY,,1,Kto nadał nazwę 'średniowiecze' tej epoce?,2025-10-24 22:16:53.848
cmh5ev9ee00mjqhd9o1kit7bi,CLOSED_SINGLE,HISTORICAL_LITERARY,,1,Która data kończy epokę średniowiecza w Europie?,2025-10-24 22:16:53.846
cmh5ev9ec00miqhd98d44p4bg,CLOSED_SINGLE,HISTORICAL_LITERARY,,1,Co oznacza termin 'teocentryzm'?,2025-10-24 22:16:53.844
cmh5ev9ea00mhqhd9yrqxv0ep,CLOSED_SINGLE,HISTORICAL_LITERARY,,1,Skąd pochodzi nazwa 'średniowiecze'?,2025-10-24 22:16:53.842
cmh5ev9e800mgqhd9g0b21dlr,CLOSED_SINGLE,HISTORICAL_LITERARY,,1,Jaka data jest umownym początkiem epoki średniowiecza w Europie?,2025-10-24 22:16:53.84
cmh5ev9e600mfqhd9xhmaf5md,CLOSED_SINGLE,HISTORICAL_LITERARY,Pojęcia,2,Jakie mity wyjaśniają pochodzenie bogów?,2025-10-24 22:16:53.838
cmh5ev9e400meqhd9ji0be0e4,CLOSED_SINGLE,HISTORICAL_LITERARY,Pojęcia,1,Co to jest mit?,2025-10-24 22:16:53.836
cmh5ev9e100mdqhd907h9l4cg,CLOSED_SINGLE,HISTORICAL_LITERARY,Pojęcia,2,Co to jest oda?,2025-10-24 22:16:53.834
cmh5ev9dz00mcqhd910fpwmrk,CLOSED_SINGLE,HISTORICAL_LITERARY,Pojęcia,2,Co to jest epos?,2025-10-24 22:16:53.832
cmh5ev9dx00mbqhd9baed0hj8,CLOSED_SINGLE,HISTORICAL_LITERARY,Pojęcia,1,Co oznacza pojęcie 'fatum'?,2025-10-24 22:16:53.83
cmh5ev9dv00maqhd9qfuimi9k,CLOSED_SINGLE,HISTORICAL_LITERARY,Sztuka,2,Kim był Fidiasz?,2025-10-24 22:16:53.827
cmh5ev9dt00m9qhd9d5qhpykj,CLOSED_SINGLE,HISTORICAL_LITERARY,Sztuka,1,"Jak nazywa się rzymski amfiteatr, w którym odbywały się walki gladiatorów?",2025-10-24 22:16:53.825
cmh5ev9dq00m8qhd9459eb0ij,CLOSED_SINGLE,HISTORICAL_LITERARY,Sztuka,1,Jak nazywa się słynna świątynia Ateny na greckim Akropolu?,2025-10-24 22:16:53.823
cmh5ev9do00m7qhd9p9n6yb91,CLOSED_SINGLE,HISTORICAL_LITERARY,Sztuka,2,Który styl był najpóźniejszy w architekturze greckiej i miał zdobienia w kształcie liści?,2025-10-24 22:16:53.82
cmh5ev9dm00m6qhd9ira88k9u,CLOSED_SINGLE,HISTORICAL_LITERARY,Sztuka,2,Który styl architektury greckiej miał charakterystyczne 'ślimaczki' przypominające baranie rogi?,2025-10-24 22:16:53.818
cmh5ev9dk00m5qhd9t291bpix,CLOSED_SINGLE,HISTORICAL_LITERARY,Sztuka,2,Który styl greckiej architektury charakteryzował się masywnym trzonem kolumny bez zdobień?,2025-10-24 22:16:53.816
cmh5ev9dh00m4qhd97z1s2yi1,SHORT_ANSWER,HISTORICAL_LITERARY,,3,Wyjaśnij koncepcję katharsis w kontekście tragedii greckiej.,2025-10-24 22:16:53.814
cmh5ev9df00m3qhd97ubztwxw,SHORT_ANSWER,HISTORICAL_LITERARY,,2,Opisz mit o wojnie trojańskiej - jej przyczynę i sposób zakończenia.,2025-10-24 22:16:53.812
cmh5ev9dd00m2qhd95urj24m2,SHORT_ANSWER,HISTORICAL_LITERARY,,3,Scharakteryzuj dualizm platońskiego świata idei i świata materialnego.,2025-10-24 22:16:53.81
cmh5ev9db00m1qhd9rpf1v2kd,SHORT_ANSWER,HISTORICAL_LITERARY,,2,"Wyjaśnij, czym różniła się filozofia epikurejczyków od hedonizmu.",2025-10-24 22:16:53.807
cmh5ev9d900m0qhd96jwec57m,SHORT_ANSWER,HISTORICAL_LITERARY,,2,Opisz główne założenia stoicyzmu jako postawy życiowej.,2025-10-24 22:16:53.805
cmh5ev9d600lzqhd9azsqur2u,SHORT_ANSWER,HISTORICAL_LITERARY,,3,"Wyjaśnij, czym różni się konflikt tragiczny od zwykłego konfliktu dramatycznego.",2025-10-24 22:16:53.803
cmh5ev9d400lyqhd9g73d9x73,SHORT_ANSWER,HISTORICAL_LITERARY,,2,Scharakteryzuj rolę chóru w tragedii greckiej.,2025-10-24 22:16:53.8
cmh5ev9d200lxqhd9nolw3jba,SHORT_ANSWER,HISTORICAL_LITERARY,,3,"Wyjaśnij pojęcie hybris i podaj, jakie skutki wywoływała w tragedii greckiej.",2025-10-24 22:16:53.798
cmh5ev9cz00lwqhd9vchve2um,SHORT_ANSWER,HISTORICAL_LITERARY,,2,"Opisz, na czym polegała zasada trzech jedności w tragedii antycznej.",2025-10-24 22:16:53.796
cmh5ev9cx00lvqhd9jiny1gg9,SHORT_ANSWER,HISTORICAL_LITERARY,,2,"Wyjaśnij, czym jest mimesis w sztuce antycznej i podaj przykład jej zastosowania.",2025-10-24 22:16:53.793
cmh5ev9cu00luqhd9jlm7dtxv,CLOSED_MULTIPLE,HISTORICAL_LITERARY,,3,Które gatunki literackie powstały w antyku? (wybierz wszystkie poprawne),2025-10-24 22:16:53.791
cmh5ev9cs00ltqhd98t489x2y,CLOSED_MULTIPLE,HISTORICAL_LITERARY,,2,Uzupełnij informacje o eposie homeryckim.,2025-10-24 22:16:53.788
cmh5ev9cp00lsqhd9thswygm4,CLOSED_MULTIPLE,HISTORICAL_LITERARY,,3,Dopasuj typy mitów do ich treści.,2025-10-24 22:16:53.786
cmh5ev9cn00lrqhd9rop9jy7f,CLOSED_MULTIPLE,HISTORICAL_LITERARY,,2,Które zasady obowiązywały w tragedii antycznej? (wybierz wszystkie poprawne),2025-10-24 22:16:53.783
cmh5ev9cl00lqqhd9p3zgyrcl,CLOSED_MULTIPLE,HISTORICAL_LITERARY,,3,Które elementy należą do budowy tragedii antycznej? (wybierz wszystkie poprawne),2025-10-24 22:16:53.781
cmh5ev9cj00lpqhd9c42h8fkv,CLOSED_MULTIPLE,HISTORICAL_LITERARY,,2,Które cechy charakteryzują sztukę antyczną? (wybierz wszystkie poprawne),2025-10-24 22:16:53.779
cmh5ev9cg00loqhd9kqpaowe7,CLOSED_MULTIPLE,HISTORICAL_LITERARY,,2,Dopasuj bogów do ich funkcji w mitologii greckiej.,2025-10-24 22:16:53.777
cmh5ev9ce00lnqhd9hqw60md1,CLOSED_MULTIPLE,HISTORICAL_LITERARY,,3,Dopasuj bogów greckich do ich rzymskich odpowiedników.,2025-10-24 22:16:53.774
cmh5ev9cb00lmqhd9mk2hmfay,CLOSED_MULTIPLE,HISTORICAL_LITERARY,,2,Dopasuj szkoły filozoficzne do ich głównych założeń.,2025-10-24 22:16:53.772
cmh5ev9c900llqhd9ln9c1e94,CLOSED_MULTIPLE,HISTORICAL_LITERARY,,2,Dopasuj filozofów do ich głównych twierdzeń.,2025-10-24 22:16:53.77
cmh5ev9c700lkqhd9iyuay5ua,CLOSED_SINGLE,HISTORICAL_LITERARY,,2,"Który poeta rzymski tworzył pieśni i ody, m.in. 'Carpe diem'?",2025-10-24 22:16:53.767
cmh5ev9c500ljqhd9h4tok5s0,CLOSED_SINGLE,HISTORICAL_LITERARY,,3,Który rzymski poeta był autorem 'Eneidy'?,2025-10-24 22:16:53.765
cmh5ev9c300liqhd9bd7su4l3,CLOSED_SINGLE,HISTORICAL_LITERARY,,3,Który filozof jest twórcą Twierdzenia Pitagorasa?,2025-10-24 22:16:53.763
cmh5ev9c000lhqhd99b4kfvl8,CLOSED_SINGLE,HISTORICAL_LITERARY,,3,Który filozof wysunął teorię kulistości ziemi?,2025-10-24 22:16:53.761
cmh5ev9by00lgqhd9mnsx5atp,CLOSED_SINGLE,HISTORICAL_LITERARY,,3,"Który filozof starożytny uważał, że podstawowym elementem świata jest powietrze?",2025-10-24 22:16:53.759
cmh5ev9bw00lfqhd9pxleaptf,CLOSED_SINGLE,HISTORICAL_LITERARY,,3,"Który filozof starożytny uważał, że podstawowym elementem świata jest woda?",2025-10-24 22:16:53.757
cmh5ev9bu00leqhd91t27zsqo,CLOSED_SINGLE,HISTORICAL_LITERARY,,3,"Który filozof starożytny uważał, że podstawowym elementem świata jest ogień?",2025-10-24 22:16:53.755
cmh5ev9bs00ldqhd9dy3cmup4,CLOSED_SINGLE,HISTORICAL_LITERARY,,3,"Kto był doskonałym mówcą rzymskim, autorem mów sądowych i politycznych?",2025-10-24 22:16:53.752
cmh5ev9bq00lcqhd9x7k4t1jd,CLOSED_SINGLE,HISTORICAL_LITERARY,,3,Który cesarz rzymski był nazywany 'filozofem na tronie'?,2025-10-24 22:16:53.75
cmh5ev9bo00lbqhd9mxwzljwy,CLOSED_SINGLE,HISTORICAL_LITERARY,,3,Który filozof rzymski był nauczycielem cesarza Nerona?,2025-10-24 22:16:53.748
cmh5ev9bm00laqhd916lcu718,CLOSED_SINGLE,HISTORICAL_LITERARY,,2,W jakich językach została napisana Biblia?,2025-10-24 22:16:53.746
cmh5ev9bk00l9qhd9hm67dw34,CLOSED_SINGLE,HISTORICAL_LITERARY,,3,Co to jest Apokalipsa św. Jana?,2025-10-24 22:16:53.744
cmh5ev9bh00l8qhd989jtujk1,CLOSED_SINGLE,HISTORICAL_LITERARY,,2,Którą księgę Biblii stanowią modlitwy i pieśni?,2025-10-24 22:16:53.742
cmh5ev9bf00l7qhd9aewi8wol,CLOSED_SINGLE,HISTORICAL_LITERARY,,2,W której księdze Biblii opisane jest wyjście Izraelitów z Egiptu?,2025-10-24 22:16:53.74
cmh5ev9bd00l6qhd95es6wgai,CLOSED_SINGLE,HISTORICAL_LITERARY,,2,Która księga Biblii zawiera historię stworzenia świata?,2025-10-24 22:16:53.738
cmh5ev9bb00l5qhd9ksyhrl9r,CLOSED_SINGLE,HISTORICAL_LITERARY,,3,Kim był Priam?,2025-10-24 22:16:53.735
cmh5ev9b900l4qhd99pt4xl88,CLOSED_SINGLE,HISTORICAL_LITERARY,,3,Kim był Patrokles?,2025-10-24 22:16:53.733
cmh5ev9b700l3qhd9ouj75kuv,CLOSED_SINGLE,HISTORICAL_LITERARY,,2,Kim był Hektor w wojnie trojańskiej?,2025-10-24 22:16:53.731
cmh5ev9b500l2qhd9ftvy1jep,CLOSED_SINGLE,HISTORICAL_LITERARY,,2,Kto był największym wojownikiem greckim w wojnie trojańskiej?,2025-10-24 22:16:53.729
cmh5ev9b300l1qhd9bcf0w176,CLOSED_SINGLE,HISTORICAL_LITERARY,,3,Kto był najsłynniejszym dowódcą greckim w wojnie trojańskiej?,2025-10-24 22:16:53.727
cmh5ev9b000l0qhd9z8nsrzy1,CLOSED_SINGLE,HISTORICAL_LITERARY,,3,Kim była Demeter?,2025-10-24 22:16:53.725
cmh5ev9ay00kzqhd9kejuysdq,CLOSED_SINGLE,HISTORICAL_LITERARY,,2,Kim był Dionizos?,2025-10-24 22:16:53.723
cmh5ev9aw00kyqhd9nxora3xq,CLOSED_SINGLE,HISTORICAL_LITERARY,,3,Kim był Hefajstos?,2025-10-24 22:16:53.72
cmh5ev9au00kxqhd9tg3700fx,CLOSED_SINGLE,HISTORICAL_LITERARY,,2,Kim był Hermes?,2025-10-24 22:16:53.718
cmh5ev9ar00kwqhd967cuhov9,CLOSED_SINGLE,HISTORICAL_LITERARY,,2,Kim był Ares?,2025-10-24 22:16:53.716
cmh5ev9ap00kvqhd9yaqn6s2i,CLOSED_SINGLE,HISTORICAL_LITERARY,,2,Kim była Artemida?,2025-10-24 22:16:53.714
cmh5ev9an00kuqhd95l1il59y,CLOSED_SINGLE,HISTORICAL_LITERARY,,2,Kim był Apollo?,2025-10-24 22:16:53.711
cmh5ev9al00ktqhd9u47ehiy4,CLOSED_SINGLE,HISTORICAL_LITERARY,,2,Kim była Afrodyta?,2025-10-24 22:16:53.709
cmh5ev9aj00ksqhd96s4mbura,CLOSED_SINGLE,HISTORICAL_LITERARY,,2,Kim była Atena?,2025-10-24 22:16:53.707
cmh5ev9ag00krqhd9cwxev5ff,CLOSED_SINGLE,HISTORICAL_LITERARY,,2,Kim był Hades?,2025-10-24 22:16:53.704
cmh5ev9ae00kqqhd9ddncrz09,CLOSED_SINGLE,HISTORICAL_LITERARY,,2,Kim był Posejdon?,2025-10-24 22:16:53.702
cmh5ev9ac00kpqhd96il9nvi3,CLOSED_SINGLE,HISTORICAL_LITERARY,,2,Kim była Hera w mitologii greckiej?,2025-10-24 22:16:53.7
cmh5ev9a900koqhd9ftj8q2vi,CLOSED_SINGLE,HISTORICAL_LITERARY,,2,Kim była Reja w mitologii greckiej?,2025-10-24 22:16:53.698
cmh5ev9a700knqhd9boeg02s9,CLOSED_SINGLE,HISTORICAL_LITERARY,,2,Jaki tytan zabił swojego ojca Uranosa i został później obalony przez własnego syna?,2025-10-24 22:16:53.696
cmh5ev9a500kmqhd9gjpdch90,CLOSED_SINGLE,HISTORICAL_LITERARY,,3,Co to są mity genealogiczne?,2025-10-24 22:16:53.694
cmh5ev9a300klqhd9giwk25is,CLOSED_SINGLE,HISTORICAL_LITERARY,,3,Co to są mity kosmogoniczne?,2025-10-24 22:16:53.691
cmh5ev9a100kkqhd9hh9kcd7w,CLOSED_SINGLE,HISTORICAL_LITERARY,,3,Co to są mity teogoniczne?,2025-10-24 22:16:53.689
cmh5ev99y00kjqhd9e5xwivtj,CLOSED_SINGLE,HISTORICAL_LITERARY,,3,Kto był najsławniejszym komiediopisarzem greckim?,2025-10-24 22:16:53.687
cmh5ev99w00kiqhd9uipy5fns,CLOSED_SINGLE,HISTORICAL_LITERARY,,2,Co to jest tren?,2025-10-24 22:16:53.685
cmh5ev99u00khqhd9401yt7bd,CLOSED_SINGLE,HISTORICAL_LITERARY,,2,Co to jest elegia?,2025-10-24 22:16:53.682
cmh5ev99s00kgqhd94ar4kdnm,CLOSED_SINGLE,HISTORICAL_LITERARY,,3,Która poetka prowadziła szkołę dla dziewcząt na wyspie Lesbos?,2025-10-24 22:16:53.68
cmh5ev99q00kfqhd90frt0eqw,CLOSED_SINGLE,HISTORICAL_LITERARY,,2,"Kto był najsławniejszym twórcą poezji chóralnej, sławiącym zwycięzców igrzysk olimpijskich?",2025-10-24 22:16:53.678
cmh5ev99n00keqhd9g3aiqnkx,CLOSED_SINGLE,HISTORICAL_LITERARY,,2,Co to jest oda?,2025-10-24 22:16:53.676
cmh5ev99l00kdqhd9d2trfrt8,CLOSED_SINGLE,HISTORICAL_LITERARY,,3,Która cecha NIE jest typowa dla eposu antycznego?,2025-10-24 22:16:53.674
cmh5ev99j00kcqhd97luzsi6f,CLOSED_SINGLE,HISTORICAL_LITERARY,,2,Co to jest inwokacja w eposie?,2025-10-24 22:16:53.671
cmh5ev99h00kbqhd9d7040wgd,CLOSED_SINGLE,HISTORICAL_LITERARY,,3,"Która technika narracyjna występuje w 'Odysei', gdy Odyseusz opowiada o swoich przygodach na dworze Alkinoosa?",2025-10-24 22:16:53.669
cmh5ev99f00kaqhd917ylbnk8,CLOSED_SINGLE,HISTORICAL_LITERARY,,3,Jaki typ eposu reprezentuje 'Odyseja'?,2025-10-24 22:16:53.667
cmh5ev99d00k9qhd9w5lt92zw,CLOSED_SINGLE,HISTORICAL_LITERARY,,3,Jaki typ eposu reprezentuje 'Iliada'?,2025-10-24 22:16:53.665
cmh5ev99b00k8qhd95atzo77y,CLOSED_SINGLE,HISTORICAL_LITERARY,,2,Co to jest paralelizm fabuły w eposie antycznym?,2025-10-24 22:16:53.663
cmh5ev99900k7qhd9ise24jzj,CLOSED_SINGLE,HISTORICAL_LITERARY,,3,Jaka była rola chóru w tragedii greckiej?,2025-10-24 22:16:53.661
cmh5ev99700k6qhd95tsv0tvi,CLOSED_SINGLE,HISTORICAL_LITERARY,,2,Co oznacza zasada decorum w tragedii antycznej?,2025-10-24 22:16:53.659
cmh5ev99500k5qhd9fkc8gaeb,CLOSED_SINGLE,HISTORICAL_LITERARY,,3,"Która zasada tragedii antycznej mówi, że nie wolno przeplatać scen tragicznych z komicznymi?",2025-10-24 22:16:53.657
cmh5ev99200k4qhd9l841ljoq,CLOSED_SINGLE,HISTORICAL_LITERARY,,2,"Jak nazywa się punkt kulminacyjny tragedii, w którym bohater wyraża swój lament?",2025-10-24 22:16:53.655
cmh5ev99000k3qhd9bgeb2xoh,CLOSED_SINGLE,HISTORICAL_LITERARY,,2,Jak nazywa się wstępna pieśń chóru wchodzącego na orchestrę?,2025-10-24 22:16:53.653
cmh5ev98y00k2qhd9t0chn3kp,CLOSED_SINGLE,HISTORICAL_LITERARY,,2,"Jak nazywa się pierwsza część tragedii greckiej, która wprowadza w akcję?",2025-10-24 22:16:53.651
cmh5ev98w00k1qhd9avoe1dzh,CLOSED_SINGLE,HISTORICAL_LITERARY,,3,Co to jest hybris w kontekście tragedii greckiej?,2025-10-24 22:16:53.649
cmh5ev98u00k0qhd9jbjq2i0o,CLOSED_SINGLE,HISTORICAL_LITERARY,,2,Co to jest wina tragiczna (hamartia)?,2025-10-24 22:16:53.646
cmh5ev98s00jzqhd9tif404is,CLOSED_SINGLE,HISTORICAL_LITERARY,,2,Co to jest konflikt tragiczny w tragedii antycznej?,2025-10-24 22:16:53.644
cmh5ev98q00jyqhd9ng3vt8j3,CLOSED_SINGLE,HISTORICAL_LITERARY,,1,Ile ewangelii znajduje się w Nowym Testamencie?,2025-10-24 22:16:53.642
cmh5ev98o00jxqhd98owtyyav,CLOSED_SINGLE,HISTORICAL_LITERARY,,1,Jak nazywa się pierwszych pięć ksiąg Starego Testamentu?,2025-10-24 22:16:53.64
cmh5ev98m00jwqhd9d3vkdq2g,CLOSED_SINGLE,HISTORICAL_LITERARY,,1,Ile ksiąg zawiera Biblia?,2025-10-24 22:16:53.638
cmh5ev98k00jvqhd9lk8l8hiq,CLOSED_SINGLE,HISTORICAL_LITERARY,,2,Kto wpadł na pomysł drewnianego konia trojańskiego?,2025-10-24 22:16:53.636
cmh5ev98i00juqhd9pk61qn0g,CLOSED_SINGLE,HISTORICAL_LITERARY,,1,"Kto był królem Sparty, którego żonę Helenę porwał Parys?",2025-10-24 22:16:53.634
cmh5ev98g00jtqhd9ir9bd37v,CLOSED_SINGLE,HISTORICAL_LITERARY,,1,"Która bogini rzuciła złote jabłko z napisem 'dla najpiękniejszej', wywołując wojnę trojańską?",2025-10-24 22:16:53.632
cmh5ev98e00jsqhd9x6nawotl,CLOSED_SINGLE,HISTORICAL_LITERARY,,1,Kto był głównym bogiem w panteonie greckim?,2025-10-24 22:16:53.63
cmh5ev98c00jrqhd99slvis9t,CLOSED_SINGLE,HISTORICAL_LITERARY,,1,Kim była Gaja w mitologii greckiej?,2025-10-24 22:16:53.628
cmh5ev98a00jqqhd94pni35bd,CLOSED_SINGLE,HISTORICAL_LITERARY,,1,Kto był ojcem pierwszych bogów greckich?,2025-10-24 22:16:53.626
cmh5ev98800jpqhd9xrwtibxe,CLOSED_SINGLE,HISTORICAL_LITERARY,,1,"Co według mitologii greckiej było na początku, przed powstaniem świata?",2025-10-24 22:16:53.624
cmh5ev98600joqhd9y8wb1uiu,CLOSED_SINGLE,HISTORICAL_LITERARY,,1,Co to jest monoteizm?,2025-10-24 22:16:53.622
cmh5ev98400jnqhd91snkktyq,CLOSED_SINGLE,HISTORICAL_LITERARY,,1,Co to jest politeizm?,2025-10-24 22:16:53.62
cmh5ev98200jmqhd9cux5ib2g,CLOSED_SINGLE,HISTORICAL_LITERARY,,1,Którzy z wymienionych byli najsłynniejszymi rzeźbiarzami starożytnej Grecji?,2025-10-24 22:16:53.618
cmh5ev97z00jlqhd9weqtwzzg,CLOSED_SINGLE,HISTORICAL_LITERARY,,2,"Który styl architektoniczny był najpóźniejszy i najbardziej zdobny, z ornamentami w kształcie liści?",2025-10-24 22:16:53.616
cmh5ev97x00jkqhd9ykqilodf,CLOSED_SINGLE,HISTORICAL_LITERARY,,2,Który styl architektoniczny charakteryzował się zdobieniami w kształcie ślimaków przypominających baranie rogi?,2025-10-24 22:16:53.614
cmh5ev97v00jjqhd97osyrj9o,CLOSED_SINGLE,HISTORICAL_LITERARY,,1,Ile stylów architektonicznych wyróżniano w starożytnej Grecji?,2025-10-24 22:16:53.612
cmh5ev97t00jiqhd9zcgwydf0,CLOSED_SINGLE,HISTORICAL_LITERARY,,2,"Kto tworzył poezję tyrtejską – patriotyczną, nawołującą do walki?",2025-10-24 22:16:53.61
cmh5ev97r00jhqhd9beykxjn7,CLOSED_SINGLE,HISTORICAL_LITERARY,,1,Co to są anakreontyki?,2025-10-24 22:16:53.608
cmh5ev97p00jgqhd9ul8cbfqc,CLOSED_SINGLE,HISTORICAL_LITERARY,,1,Co to jest strofa saficka?,2025-10-24 22:16:53.606
cmh5ev97n00jfqhd95doi4vdq,CLOSED_SINGLE,HISTORICAL_LITERARY,,2,Która poetka grecka była nazywana 'dziesiątą Muzą'?,2025-10-24 22:16:53.603
cmh5ev97l00jeqhd9gzdjmvxj,CLOSED_SINGLE,HISTORICAL_LITERARY,,2,Co to jest fatum?,2025-10-24 22:16:53.601
cmh5ev97j00jdqhd9htxiobgk,CLOSED_SINGLE,HISTORICAL_LITERARY,,2,Co to jest mimesis?,2025-10-24 22:16:53.599
cmh5ev97h00jcqhd9zzbureoj,CLOSED_SINGLE,HISTORICAL_LITERARY,,1,Ile aktorów mogło występować jednocześnie na scenie w tragedii greckiej?,2025-10-24 22:16:53.597
cmh5ev97f00jbqhd9l2jw4tbq,CLOSED_SINGLE,HISTORICAL_LITERARY,,2,Co to jest katharsis?,2025-10-24 22:16:53.595
cmh5ev97d00jaqhd9bscxnf12,CLOSED_SINGLE,HISTORICAL_LITERARY,,1,Skąd wywodzi się teatr grecki?,2025-10-24 22:16:53.593
cmh5ev97a00j9qhd9btvf9nis,CLOSED_SINGLE,HISTORICAL_LITERARY,,1,Kim byli trzej wielcy tragicy greccy?,2025-10-24 22:16:53.591
cmh5ev97800j8qhd9hp1e4es6,CLOSED_SINGLE,HISTORICAL_LITERARY,,2,Kto napisał 'Teogonię' – utwór o pochodzeniu bogów?,2025-10-24 22:16:53.588
cmh5ev97500j7qhd9659abdki,CLOSED_SINGLE,HISTORICAL_LITERARY,,1,Co to jest epos?,2025-10-24 22:16:53.586
cmh5ev97300j6qhd98lkt9j05,CLOSED_SINGLE,HISTORICAL_LITERARY,,2,Co to jest 'kwestia homerycka'?,2025-10-24 22:16:53.583
cmh5ev97000j5qhd9pxsm0jgz,CLOSED_SINGLE,HISTORICAL_LITERARY,,2,Jakim metrum zostały napisane 'Iliada' i 'Odyseja'?,2025-10-24 22:16:53.58
cmh5ev96x00j4qhd9hhen9ibn,CLOSED_SINGLE,HISTORICAL_LITERARY,Odyseja,1,Jak nazywał się syn Odyseusza?,2025-10-24 22:16:53.578
cmh5ev96v00j3qhd92s9m4lm7,CLOSED_SINGLE,HISTORICAL_LITERARY,Odyseja,1,Jak nazywała się żona Odyseusza?,2025-10-24 22:16:53.576
cmh5ev96t00j2qhd9fff6qcuq,CLOSED_SINGLE,HISTORICAL_LITERARY,Odyseja,1,Ile lat trwał powrót Odyseusza do Itaki?,2025-10-24 22:16:53.574
cmh5ev96r00j1qhd92x54m6g4,CLOSED_SINGLE,HISTORICAL_LITERARY,Iliada,1,Ile dni wojny trojańskiej opisuje 'Iliada'?,2025-10-24 22:16:53.572
cmh5ev96p00j0qhd9ikjtrsho,CLOSED_SINGLE,HISTORICAL_LITERARY,,1,Kto napisał eposy 'Iliada' i 'Odyseja'?,2025-10-24 22:16:53.57
cmh5ev96n00izqhd9xk5348sf,CLOSED_SINGLE,HISTORICAL_LITERARY,,1,Który filozof stworzył dualizm świata – teorię o współistnieniu świata idei i świata materialnego?,2025-10-24 22:16:53.568
cmh5ev96l00iyqhd9q0at2wby,CLOSED_SINGLE,HISTORICAL_LITERARY,,1,Który filozof został nazwany 'ojcem medycyny'?,2025-10-24 22:16:53.566
cmh5ev96j00ixqhd9fr24pz2p,CLOSED_SINGLE,HISTORICAL_LITERARY,,1,Kim byli sofiści?,2025-10-24 22:16:53.564
cmh5ev96h00iwqhd90lpw9m9q,CLOSED_SINGLE,HISTORICAL_LITERARY,,2,Co to jest stoicyzm jako postawa życiowa?,2025-10-24 22:16:53.561
cmh5ev96f00ivqhd9hgbq1dqk,CLOSED_SINGLE,HISTORICAL_LITERARY,,1,Kto był uczniem Platona i nauczycielem Aleksandra Wielkiego?,2025-10-24 22:16:53.559
